{
  "schema_version": "carr-visual-recipe-library.v1",
  "library_id": "library:carr-visual-recipes",
  "version": "v1",
  "status": "active_contract_not_a_runtime_or_authority",
  "inherits": {
    "design_kernel_contract_id": "contract:carr-design-kernel",
    "design_kernel_version": "v1",
    "inheritance_rule": "recipes_may_not_redefine_authority_truth_accessibility_tokens_or_component_states"
  },
  "selection_policy": {
    "candidate_count": [2, 4],
    "human_confirmation_required": true,
    "hidden_taste_selection_forbidden": true,
    "evaluation_posture": "recipe_conformance_is_advisory_critical_design_kernel_gates_remain_unmaskable"
  },
  "workflow": {
    "steps": [
      {"step_id": "request", "instruction": "A future surface requests one Design Kernel intent and the user job; the router returns only 2–4 fitting recipes plus the narrow core design context.", "enforcement": "no giant preset load and no hidden aesthetic winner"},
      {"step_id": "compare", "instruction": "Render each candidate with the same synthetic or source-bound content so the visual differences are honest and inspectable by Joe and Dell.", "enforcement": "comparison labels, evidence/freshness treatment, and critical Design Kernel gates remain visible"},
      {"step_id": "confirm", "instruction": "A human selects one displayed recipe and states a short rationale after reviewing the visual candidates.", "enforcement": "selection receipt requires displayed recipe id, human, rationale, exact candidate digest, and UTC time"},
      {"step_id": "bind", "instruction": "The surface generates against the selected recipe plus only the core Design Kernel slices needed for its intent.", "enforcement": "recipe conformance is advisory; authority, truth, accessibility, and promotion policy remain outside recipe control"}
    ]
  },
  "recipes": [
    {
      "recipe_id": "recipe:operational-command-center",
      "label": "Operational Command Center",
      "fit_statement": "Use when an operator must notice, prioritize, and act on live work without losing the evidence trail.",
      "intent_ids": ["intent:workspace", "intent:control-room", "intent:model-room", "intent:job-passport"],
      "audiences": ["operators", "system owners"],
      "jobs": ["triage work", "monitor health", "take bounded action"],
      "layout_grammar": ["persistent orientation rail", "priority-first queue", "detail on demand"],
      "information_density": "high",
      "hierarchy": ["what needs attention", "why it matters", "safe next action"],
      "visualization_choices": ["status ladders", "queue counts", "small evidence timelines"],
      "motion_posture": "restrained",
      "component_emphasis": ["filter controls", "state cards", "disclosure panels"],
      "evidence_freshness": ["show source and observed time beside changing claims", "make stale and unknown explicit"],
      "responsive_behavior": ["collapse rail into labeled control", "preserve priority order before density"],
      "exclusions": ["decorative dashboards", "color-only urgency", "ambient motion that competes with alerts"]
    },
    {
      "recipe_id": "recipe:spatial-market-map",
      "label": "Spatial Market Map",
      "fit_statement": "Use when location, territory, adjacency, or travel distance changes the decision.",
      "intent_ids": ["intent:workspace", "intent:deal-room", "intent:generated-artifact"],
      "audiences": ["brokers", "clients", "market researchers"],
      "jobs": ["compare trade areas", "orient a market decision", "explain location evidence"],
      "layout_grammar": ["map or spatial field as anchor", "evidence legend", "inspectable list companion"],
      "information_density": "adaptive",
      "hierarchy": ["geographic question", "spatial pattern", "record-backed details"],
      "visualization_choices": ["maps", "routes", "isochrones when sourced", "labeled overlays"],
      "motion_posture": "still",
      "component_emphasis": ["layer controls", "accessible list alternative", "evidence legend"],
      "evidence_freshness": ["name geography source, vintage, and uncertainty", "never imply a map pin proves a claim"],
      "responsive_behavior": ["switch to ordered list plus focused map", "keep legend and source visible"],
      "exclusions": ["unsourced heatmaps", "map-only meaning", "decorative satellite imagery"]
    },
    {
      "recipe_id": "recipe:evidence-timeline",
      "label": "Evidence Timeline",
      "fit_statement": "Use when sequence, provenance, and what changed are more important than a current snapshot.",
      "intent_ids": ["intent:workspace", "intent:job-passport", "intent:generated-artifact"],
      "audiences": ["operators", "reviewers", "clients needing a clear narrative"],
      "jobs": ["reconstruct a decision", "review progress", "surface exceptions"],
      "layout_grammar": ["chronological spine", "event cards", "current-state summary"],
      "information_density": "medium",
      "hierarchy": ["current verified state", "key transitions", "source-linked detail"],
      "visualization_choices": ["timelines", "milestone markers", "before-and-after comparisons"],
      "motion_posture": "still",
      "component_emphasis": ["date filters", "expandable evidence", "state badges with text"],
      "evidence_freshness": ["each event carries observed time and evidence reference", "gaps remain gaps"],
      "responsive_behavior": ["single-column chronological flow", "never hide event labels behind hover"],
      "exclusions": ["fictional continuity", "undated summaries", "animation as chronology"]
    },
    {
      "recipe_id": "recipe:executive-briefing",
      "label": "Executive Briefing",
      "fit_statement": "Use when a decision-maker needs the answer, its confidence, and the decision path in one scan.",
      "intent_ids": ["intent:generated-artifact", "intent:workspace", "intent:deal-room"],
      "audiences": ["Joe", "Dell", "client principals"],
      "jobs": ["make a decision", "review options", "align on next move"],
      "layout_grammar": ["answer-first headline", "decision cards", "evidence appendix"],
      "information_density": "medium",
      "hierarchy": ["recommendation or question", "material tradeoffs", "supporting evidence"],
      "visualization_choices": ["decision matrix", "small comparison bars", "annotated callouts"],
      "motion_posture": "still",
      "component_emphasis": ["summary cards", "clear callouts", "source disclosures"],
      "evidence_freshness": ["distinguish verified evidence from inference", "show as-of time on recommendations"],
      "responsive_behavior": ["one decisive column", "appendix remains reachable without modal traps"],
      "exclusions": ["metric theater", "buried recommendation", "false certainty"]
    },
    {
      "recipe_id": "recipe:client-presentation",
      "label": "Client Presentation",
      "fit_statement": "Use for a calm, guided client story that makes a recommendation inspectable rather than salesy.",
      "intent_ids": ["intent:generated-artifact", "intent:deal-room"],
      "audiences": ["healthcare real-estate clients", "client teams"],
      "jobs": ["explain a strategy", "compare sites", "prepare for a meeting"],
      "layout_grammar": ["narrative sections", "one decision per panel", "source notes near claims"],
      "information_density": "low",
      "hierarchy": ["client question", "clear answer", "evidence and options"],
      "visualization_choices": ["site comparisons", "simple maps", "annotated photography only when sourced"],
      "motion_posture": "still",
      "component_emphasis": ["readable cards", "comparison tables", "print-friendly disclosures"],
      "evidence_freshness": ["cite source and as-of date in plain language", "do not flatten uncertainty for polish"],
      "responsive_behavior": ["presentation sections become a readable document", "comparison labels stay paired with values"],
      "exclusions": ["brand pastiche", "unsupported lifestyle imagery", "internal operational jargon"]
    },
    {
      "recipe_id": "recipe:dense-analytical-workstation",
      "label": "Dense Analytical Workstation",
      "fit_statement": "Use when an expert needs to compare many reliable signals and inspect exceptions quickly.",
      "intent_ids": ["intent:workspace", "intent:deal-room", "intent:control-room"],
      "audiences": ["brokers", "analysts", "operators"],
      "jobs": ["compare records", "sort evidence", "investigate exceptions"],
      "layout_grammar": ["stable table or grid", "pinned criteria", "progressive detail"],
      "information_density": "high",
      "hierarchy": ["decision columns", "exception signals", "record detail"],
      "visualization_choices": ["sortable tables", "small multiples", "linked detail panes"],
      "motion_posture": "still",
      "component_emphasis": ["filters", "column controls", "keyboard-friendly tables"],
      "evidence_freshness": ["show source and freshness per field group", "unknown values sort as unknown"],
      "responsive_behavior": ["choose a focused subset of columns", "offer card/list alternative instead of horizontal clipping"],
      "exclusions": ["tiny unreadable type", "hover-only facts", "unlabeled icon grids"]
    },
    {
      "recipe_id": "recipe:ambient-workspace",
      "label": "Ambient Workspace",
      "fit_statement": "Use for low-urgency orientation and reflection, where the field should feel calm but remain operationally honest.",
      "intent_ids": ["intent:workspace", "intent:model-room"],
      "audiences": ["Joe", "Dell", "operators returning between tasks"],
      "jobs": ["re-enter context", "notice a small number of changes", "choose where to begin"],
      "layout_grammar": ["generous orientation zone", "few high-signal modules", "quiet supporting detail"],
      "information_density": "low",
      "hierarchy": ["where am I", "what changed", "what is next"],